segment,target_name,company,source_url,why_relevant,channel,status,next_action,notes
Warm intro,,,,Existing investors, clients, bankers, fund managers, and advisors who know family offices,LinkedIn/WhatsApp,Not started,Ask for 3 intros,
Private banker,,,,Private banks often see family office reporting pain before vendors do,LinkedIn,Not started,Send short DM,
MFO operator,,,,Multi family offices have repeated reporting and document workflows,LinkedIn,Not started,Send audit offer,
External asset manager,,,,EAMs often support wealthy families across banks and products,LinkedIn,Not started,Send audit offer,
Alts platform contact,,,,Teams dealing with private funds understand capital call and NAV workflow pain,LinkedIn,Not started,Ask for referral,
Family office advisor,,,,Tax, legal, accounting, and governance advisors can refer ops pain,Email/LinkedIn,Not started,Ask for referral,
